{
  "matrix_version": 1,
  "generator": "docs/generate-fleet-matrix.py",
  "generator_note": "PRODUCED by the generator named above; run it with --check to verify. Wiring is derived from hooks/hooks.*.json and the hermes register_hook calls on every run.",
  "rows": [
    {
      "harness": "claude",
      "min_version": "2.1.283",
      "moment": "capture-correction",
      "hook_event": "UserPromptSubmit",
      "status": "registered",
      "launcher": "capture-correction",
      "inputs": [
        {
          "name": "transcript",
          "locality": "client_local"
        },
        {
          "name": "cwd",
          "locality": "client_local"
        },
        {
          "name": "rows",
          "locality": "hub_authoritative"
        },
        {
          "name": "ledger",
          "locality": "hub_authoritative"
        }
      ],
      "hub_ops": [
        "ingest"
      ],
      "degraded": "Degrade, never block: capture locally and enqueue to the durable op queue (T-09); acknowledge locally and replay on reconnect."
    },
    {
      "harness": "claude",
      "min_version": "2.1.283",
      "moment": "capture-failure",
      "hook_event": "PostToolUseFailure",
      "status": "registered",
      "launcher": "capture-failure",
      "inputs": [
        {
          "name": "transcript",
          "locality": "client_local"
        },
        {
          "name": "tool_input",
          "locality": "client_local"
        },
        {
          "name": "tool_output",
          "locality": "client_local"
        },
        {
          "name": "rows",
          "locality": "hub_authoritative"
        },
        {
          "name": "ledger",
          "locality": "hub_authoritative"
        }
      ],
      "hub_ops": [
        "ingest"
      ],
      "degraded": "Degrade, never block: capture locally and enqueue to the durable op queue (T-09); acknowledge locally and replay on reconnect."
    },
    {
      "harness": "claude",
      "min_version": "2.1.283",
      "moment": "convention-capture",
      "hook_event": "PostToolUse",
      "status": "registered",
      "launcher": "convention-capture",
      "inputs": [
        {
          "name": "transcript",
          "locality": "client_local"
        },
        {
          "name": "tool_input",
          "locality": "client_local"
        },
        {
          "name": "tool_output",
          "locality": "client_local"
        },
        {
          "name": "rows",
          "locality": "hub_authoritative"
        },
        {
          "name": "ledger",
          "locality": "hub_authoritative"
        }
      ],
      "hub_ops": [
        "ingest"
      ],
      "degraded": "Degrade, never block: capture locally and enqueue to the durable op queue (T-09); acknowledge locally and replay on reconnect."
    },
    {
      "harness": "claude",
      "min_version": "2.1.283",
      "moment": "postcompact",
      "hook_event": "PostCompact",
      "status": "registered",
      "launcher": "postcompact",
      "inputs": [
        {
          "name": "transcript",
          "locality": "client_local"
        },
        {
          "name": "rows",
          "locality": "hub_authoritative"
        },
        {
          "name": "policy",
          "locality": "hub_authoritative"
        }
      ],
      "hub_ops": [
        "select"
      ],
      "degraded": "Degrade, never block: inject from a valid, unexpired broker snapshot labelled [OFFLINE SNAPSHOT r<rev>, <age> old] (T-11); if no valid unexpired snapshot exists, inject nothing and record reason: \"hub-unreachable\".",
      "notes": "Registered (hooks.claude.json wires PostCompact) but a deliberate no-op per issue #158: hooks/zmem-postcompact.sh prints {} and exits, and the verb is absent from TRANSLATED_HOOKS. No output channel exists until a later Workstream T PR adds one."
    },
    {
      "harness": "claude",
      "min_version": "2.1.283",
      "moment": "posttoolbatch-recall",
      "hook_event": "PostToolBatch",
      "status": "registered",
      "launcher": "posttoolbatch-recall",
      "inputs": [
        {
          "name": "transcript",
          "locality": "client_local"
        },
        {
          "name": "rows",
          "locality": "hub_authoritative"
        },
        {
          "name": "embeddings",
          "locality": "hub_authoritative"
        },
        {
          "name": "ledger",
          "locality": "hub_authoritative"
        },
        {
          "name": "policy",
          "locality": "hub_authoritative"
        }
      ],
      "hub_ops": [
        "select"
      ],
      "degraded": "Degrade, never block: inject from a valid, unexpired broker snapshot labelled [OFFLINE SNAPSHOT r<rev>, <age> old] (T-11); if no valid unexpired snapshot exists, inject nothing and record reason: \"hub-unreachable\"."
    },
    {
      "harness": "claude",
      "min_version": "2.1.283",
      "moment": "precompact",
      "hook_event": "PreCompact",
      "status": "registered",
      "launcher": "precompact",
      "inputs": [
        {
          "name": "transcript",
          "locality": "client_local"
        },
        {
          "name": "rows",
          "locality": "hub_authoritative"
        },
        {
          "name": "policy",
          "locality": "hub_authoritative"
        }
      ],
      "hub_ops": [
        "select"
      ],
      "degraded": "Degrade, never block: inject from a valid, unexpired broker snapshot labelled [OFFLINE SNAPSHOT r<rev>, <age> old] (T-11); if no valid unexpired snapshot exists, inject nothing and record reason: \"hub-unreachable\"."
    },
    {
      "harness": "claude",
      "min_version": "2.1.283",
      "moment": "pretool-recall",
      "hook_event": "PreToolUse",
      "status": "registered",
      "launcher": "pretool-recall",
      "inputs": [
        {
          "name": "transcript",
          "locality": "client_local"
        },
        {
          "name": "tool_input",
          "locality": "client_local"
        },
        {
          "name": "cwd",
          "locality": "client_local"
        },
        {
          "name": "rows",
          "locality": "hub_authoritative"
        },
        {
          "name": "embeddings",
          "locality": "hub_authoritative"
        },
        {
          "name": "ledger",
          "locality": "hub_authoritative"
        },
        {
          "name": "policy",
          "locality": "hub_authoritative"
        }
      ],
      "hub_ops": [
        "select"
      ],
      "degraded": "Degrade, never block: inject from a valid, unexpired broker snapshot labelled [OFFLINE SNAPSHOT r<rev>, <age> old] (T-11); if no valid unexpired snapshot exists, inject nothing and record reason: \"hub-unreachable\"."
    },
    {
      "harness": "claude",
      "min_version": "2.1.283",
      "moment": "recall",
      "hook_event": "UserPromptSubmit",
      "status": "registered",
      "launcher": "recall",
      "inputs": [
        {
          "name": "transcript",
          "locality": "client_local"
        },
        {
          "name": "git remote",
          "locality": "client_local"
        },
        {
          "name": "namespace",
          "locality": "client_local"
        },
        {
          "name": "cwd",
          "locality": "client_local"
        },
        {
          "name": "rows",
          "locality": "hub_authoritative"
        },
        {
          "name": "embeddings",
          "locality": "hub_authoritative"
        },
        {
          "name": "ledger",
          "locality": "hub_authoritative"
        },
        {
          "name": "policy",
          "locality": "hub_authoritative"
        }
      ],
      "hub_ops": [
        "select"
      ],
      "degraded": "Degrade, never block: inject from a valid, unexpired broker snapshot labelled [OFFLINE SNAPSHOT r<rev>, <age> old] (T-11); if no valid unexpired snapshot exists, inject nothing and record reason: \"hub-unreachable\"."
    },
    {
      "harness": "claude",
      "min_version": "2.1.283",
      "moment": "reflect",
      "hook_event": "Stop",
      "status": "registered",
      "launcher": "reflect",
      "inputs": [
        {
          "name": "transcript",
          "locality": "client_local"
        },
        {
          "name": "cwd",
          "locality": "client_local"
        },
        {
          "name": "rows",
          "locality": "hub_authoritative"
        },
        {
          "name": "ledger",
          "locality": "hub_authoritative"
        }
      ],
      "hub_ops": [
        "ingest"
      ],
      "degraded": "Degrade, never block: compute failure evidence locally from the transcript, enqueue it to the durable op queue (T-09), and render the reflection nudge locally."
    },
    {
      "harness": "claude",
      "min_version": "2.1.283",
      "moment": "session-end",
      "hook_event": "SessionEnd",
      "status": "registered",
      "launcher": "session-end",
      "inputs": [
        {
          "name": "transcript",
          "locality": "client_local"
        },
        {
          "name": "ledger",
          "locality": "hub_authoritative"
        }
      ],
      "hub_ops": [
        "flush"
      ],
      "degraded": "Degrade, never block: flush the durable op queue best-effort; never block session teardown."
    },
    {
      "harness": "claude",
      "min_version": "2.1.283",
      "moment": "session-start",
      "hook_event": "SessionStart",
      "status": "registered",
      "launcher": "session-start",
      "inputs": [
        {
          "name": "Tier 0 files",
          "locality": "client_local"
        },
        {
          "name": "git remote",
          "locality": "client_local"
        },
        {
          "name": "namespace",
          "locality": "client_local"
        },
        {
          "name": "cwd",
          "locality": "client_local"
        },
        {
          "name": "transcript",